{
  "schema_version": "0.1.0",
  "pack": {
    "id": "sunny-meadow",
    "title": "Sunny Meadow",
    "version": "0.1.0-alpha.2",
    "generator": {
      "name": "Mapsoo Worldsmith",
      "version": "0.1.0-alpha.2"
    },
    "created_at": "2026-07-18T20:38:44.843Z"
  },
  "compatibility": {
    "godot_min": "4.3",
    "grid": "orthogonal",
    "art_style": "pixel_art",
    "importer": {
      "id": "mapsoo_importer",
      "min_version": "0.1.0-alpha.1",
      "source": "https://github.com/babyrush0101-source/mapsoo-kids"
    }
  },
  "world_spec": {
    "path": "worlds/sunny-meadow.world.json",
    "sha256": "a02f45826484439f8a346bce7aa27277f5ae9dc1d293320039cd29eea11a76d8"
  },
  "demo": {
    "map": "worlds/demo-world.json",
    "preview": "previews/map-preview.png"
  },
  "layers": [
    {
      "id": "ground",
      "kind": "tilemap",
      "path": "worlds/demo-world.json",
      "json_pointer": "/layers/0/cells",
      "encoding": "row-major",
      "dimensions_cells": [
        24,
        16
      ],
      "atlas_id": "terrain",
      "empty_tile_id": -1
    },
    {
      "id": "props",
      "kind": "objects",
      "path": "worlds/demo-world.json",
      "json_pointer": "/props",
      "encoding": "objects",
      "sprite_atlas": "atlases/props.png"
    }
  ],
  "receipt": {
    "path": "generation-receipt.json"
  },
  "atlases": [
    {
      "id": "terrain",
      "source_id": 0,
      "file": "atlases/terrain.png",
      "image_size_px": [
        128,
        32
      ],
      "cell_size_px": [
        32,
        32
      ],
      "margin_px": [
        0,
        0
      ],
      "separation_px": [
        0,
        0
      ],
      "texture_padding": true,
      "tiles": [
        {
          "tile_id": 0,
          "id": "ground_01",
          "atlas_coords": [
            0,
            0
          ],
          "size_cells": [
            1,
            1
          ],
          "alternative_id": 0,
          "collision": {
            "type": "none"
          },
          "terrain": null,
          "custom_data": {
            "walkable": true,
            "biome": "meadow"
          },
          "tags": [
            "terrain",
            "ground"
          ]
        },
        {
          "tile_id": 1,
          "id": "water_01",
          "atlas_coords": [
            1,
            0
          ],
          "size_cells": [
            1,
            1
          ],
          "alternative_id": 0,
          "collision": {
            "type": "none"
          },
          "terrain": null,
          "custom_data": {
            "walkable": false,
            "biome": "meadow"
          },
          "tags": [
            "terrain",
            "water"
          ]
        },
        {
          "tile_id": 2,
          "id": "path_01",
          "atlas_coords": [
            2,
            0
          ],
          "size_cells": [
            1,
            1
          ],
          "alternative_id": 0,
          "collision": {
            "type": "none"
          },
          "terrain": null,
          "custom_data": {
            "walkable": true,
            "biome": "meadow"
          },
          "tags": [
            "terrain",
            "path"
          ]
        },
        {
          "tile_id": 3,
          "id": "detail_01",
          "atlas_coords": [
            3,
            0
          ],
          "size_cells": [
            1,
            1
          ],
          "alternative_id": 0,
          "collision": {
            "type": "none"
          },
          "terrain": null,
          "custom_data": {
            "walkable": true,
            "biome": "meadow"
          },
          "tags": [
            "terrain",
            "detail"
          ]
        }
      ]
    }
  ],
  "sprites": [
    {
      "id": "tree_01",
      "atlas": "atlases/props.png",
      "region_px": [
        0,
        0,
        32,
        32
      ],
      "pivot_px": [
        16,
        32
      ],
      "footprint_cells": [
        1,
        1
      ],
      "tags": [
        "prop",
        "tree",
        "meadow"
      ]
    },
    {
      "id": "rock_01",
      "atlas": "atlases/props.png",
      "region_px": [
        32,
        0,
        32,
        32
      ],
      "pivot_px": [
        16,
        32
      ],
      "footprint_cells": [
        1,
        1
      ],
      "tags": [
        "prop",
        "rock",
        "meadow"
      ]
    },
    {
      "id": "flower_01",
      "atlas": "atlases/props.png",
      "region_px": [
        64,
        0,
        32,
        32
      ],
      "pivot_px": [
        16,
        32
      ],
      "footprint_cells": [
        1,
        1
      ],
      "tags": [
        "prop",
        "flower",
        "meadow"
      ]
    }
  ],
  "files": [
    {
      "path": "readme.md",
      "media_type": "text/markdown",
      "bytes": 1037,
      "sha256": "9d4360971801874cb1b4f309a2813d68e18e18c3d245da61dcd8fc8e598939a1"
    },
    {
      "path": "license-assets.md",
      "media_type": "text/markdown",
      "bytes": 1490,
      "sha256": "d6cc6123ec166535f80eddb81ac8540702cc9d83823c11a84a947bbdd265a429"
    },
    {
      "path": "worlds/sunny-meadow.world.json",
      "media_type": "application/json",
      "bytes": 538,
      "sha256": "a02f45826484439f8a346bce7aa27277f5ae9dc1d293320039cd29eea11a76d8"
    },
    {
      "path": "worlds/demo-world.json",
      "media_type": "application/json",
      "bytes": 7008,
      "sha256": "d93472024229b6e29c03fb6ae6ad132273980c03e9ed610cacd52364a3d06b53"
    },
    {
      "path": "atlases/terrain.png",
      "media_type": "image/png",
      "bytes": 245,
      "sha256": "fef3d5af0817ca0776a0e6b4b42035075126fa54383380393c8a443e28fcc42d"
    },
    {
      "path": "atlases/props.png",
      "media_type": "image/png",
      "bytes": 195,
      "sha256": "cdaa247a797782e6c8805de3520e1416ad4bb175af4e11c953f0197a375eca7e"
    },
    {
      "path": "previews/map-preview.png",
      "media_type": "image/png",
      "bytes": 8686,
      "sha256": "4f507ebe2bcec55c4dffc3eac1e9c7c34ee1747ee7bbb42f3de2eb74f1e0a0f2"
    },
    {
      "path": "schema/mapsoo-pack.schema.json",
      "media_type": "application/json",
      "bytes": 12390,
      "sha256": "f96197c2b4bb77ced7b8ecbbe5182bf6f6713f358f8f58eaf01b2baf7e378f4c"
    },
    {
      "path": "schema/mapsoo-world.schema.json",
      "media_type": "application/json",
      "bytes": 2939,
      "sha256": "ea4456e641fe956fee0d04703b326d48816c366caf31ae394341f7fb157ac7ed"
    },
    {
      "path": "schema/mapsoo-generation-receipt.schema.json",
      "media_type": "application/json",
      "bytes": 12863,
      "sha256": "264eabca313b083185968cfe362cb70e7ddd4508fb3b64bfc97e2571de6c2a76"
    },
    {
      "path": "generation-receipt.json",
      "media_type": "application/json",
      "bytes": 1093,
      "sha256": "0b85e1aa28271122b12323c0aa5cb5277a8d741e2032e5e0c12cb6d38be049cf"
    }
  ],
  "license": {
    "assets": {
      "id": "CC0-1.0",
      "file": "license-assets.md"
    }
  },
  "provenance": {
    "contains_generative_ai": false,
    "model_provider": null,
    "model": null,
    "seed": "mapsoo-demo-001",
    "human_curated": false
  }
}
